{
  "schema_version": "0.1.0",
  "run_id": "doctor-a4b9d59c951a",
  "harness_version": "0.1.0",
  "status": "passed",
  "checks": [
    {
      "id": "schema-validity",
      "version": "0.1.0",
      "category": "schema",
      "inputs": ["examples/harness.yaml"],
      "determinism": "deterministic",
      "severity": "error",
      "outcome": "passed",
      "evidence": [
        {
          "path": "examples/harness.yaml",
          "media_type": "application/yaml",
          "description": "Harness schema validation passed."
        }
      ],
      "remediation": "No remediation required.",
      "fixtures": ["examples/fixtures/invalid/harness-with-plugin-key.yaml"],
      "false_positive_policy": "Doctor findings are deterministic structural findings. Treat false positives as schema/check contract bugs and fix the fixture or check definition before suppressing.",
      "exit_semantics": {
        "pass": 0,
        "warn": 1,
        "fail": 1
      },
      "trust_requirements": {
        "trust_level": "sandboxed",
        "sandbox_required": "process",
        "network_access": false,
        "secret_access": false,
        "host_file_access": false,
        "allowed_inputs": [],
        "allowed_outputs": []
      }
    },
    {
      "id": "engine-compatibility",
      "version": "0.1.0",
      "category": "compatibility",
      "inputs": ["examples/harness.yaml"],
      "determinism": "deterministic",
      "severity": "error",
      "outcome": "passed",
      "evidence": [
        {
          "path": "examples/harness.yaml",
          "media_type": "application/yaml",
          "description": "CLI and schema engine ranges are compatible with the local package."
        }
      ],
      "remediation": "No remediation required.",
      "fixtures": ["examples/fixtures/doctor/incompatible-engine.yaml"],
      "false_positive_policy": "Doctor findings are deterministic structural findings. Treat false positives as schema/check contract bugs and fix the fixture or check definition before suppressing.",
      "exit_semantics": {
        "pass": 0,
        "warn": 1,
        "fail": 1
      },
      "trust_requirements": {
        "trust_level": "sandboxed",
        "sandbox_required": "process",
        "network_access": false,
        "secret_access": false,
        "host_file_access": false,
        "allowed_inputs": [],
        "allowed_outputs": []
      }
    },
    {
      "id": "reference-exists",
      "version": "0.1.0",
      "category": "references",
      "inputs": [
        "AGENTS.md",
        "README.md",
        "examples/agent-runners/stub.yaml",
        "examples/checks/doc-links.yaml",
        "examples/environments/local.yaml",
        "examples/evals/harness-self-test/v1.0.0",
        "examples/failure-taxonomy.yaml",
        "examples/harness.yaml",
        "examples/model-profiles/stub.yaml",
        "examples/policies/approval-policy.yaml",
        "examples/policies/sandbox-policy.yaml",
        "examples/traces/native-cli-trace.json"
      ],
      "determinism": "deterministic",
      "severity": "error",
      "outcome": "passed",
      "evidence": [
        {
          "path": "examples/harness.yaml",
          "media_type": "application/yaml",
          "description": "11 composed reference(s) resolved and validated."
        }
      ],
      "remediation": "No remediation required.",
      "fixtures": ["examples/fixtures/doctor/missing-reference.yaml"],
      "false_positive_policy": "Doctor findings are deterministic structural findings. Treat false positives as schema/check contract bugs and fix the fixture or check definition before suppressing.",
      "exit_semantics": {
        "pass": 0,
        "warn": 1,
        "fail": 1
      },
      "trust_requirements": {
        "trust_level": "sandboxed",
        "sandbox_required": "process",
        "network_access": false,
        "secret_access": false,
        "host_file_access": false,
        "allowed_inputs": [],
        "allowed_outputs": []
      }
    },
    {
      "id": "builtin-check-supported",
      "version": "0.1.0",
      "category": "doctor-registration",
      "inputs": ["examples/harness.yaml"],
      "determinism": "deterministic",
      "severity": "error",
      "outcome": "passed",
      "evidence": [
        {
          "path": "examples/harness.yaml",
          "media_type": "application/yaml",
          "description": "Every declared builtin doctor check is supported by this CLI."
        }
      ],
      "remediation": "No remediation required.",
      "fixtures": ["examples/fixtures/doctor/unsupported-builtin.yaml"],
      "false_positive_policy": "Doctor findings are deterministic structural findings. Treat false positives as schema/check contract bugs and fix the fixture or check definition before suppressing.",
      "exit_semantics": {
        "pass": 0,
        "warn": 1,
        "fail": 1
      },
      "trust_requirements": {
        "trust_level": "sandboxed",
        "sandbox_required": "process",
        "network_access": false,
        "secret_access": false,
        "host_file_access": false,
        "allowed_inputs": [],
        "allowed_outputs": []
      }
    },
    {
      "id": "local-doc-link-check",
      "version": "0.1.0",
      "category": "local-check-registration",
      "inputs": ["AGENTS.md", "README.md", "examples/checks/doc-links.yaml"],
      "determinism": "deterministic",
      "severity": "info",
      "outcome": "skipped",
      "evidence": [
        {
          "path": "examples/checks/doc-links.yaml",
          "media_type": "application/yaml",
          "description": "Local doctor check is declared with trust requirements but is not executed by the current doctor command."
        }
      ],
      "remediation": "Keep the declaration for future local-check execution support; the current doctor command validates registration only.",
      "fixtures": ["examples/checks/doc-links.yaml"],
      "false_positive_policy": "Doctor findings are deterministic structural findings. Treat false positives as schema/check contract bugs and fix the fixture or check definition before suppressing.",
      "exit_semantics": {
        "pass": 0,
        "warn": 1,
        "fail": 1
      },
      "trust_requirements": {
        "trust_level": "sandboxed",
        "sandbox_required": "process",
        "network_access": false,
        "secret_access": false,
        "host_file_access": false,
        "allowed_inputs": ["README.md", "AGENTS.md"],
        "allowed_outputs": [".harness/outputs/doctor/doc-links.json"]
      }
    }
  ]
}
